{"annual":{"diff_gistemp_minus_hadcrut5":{"1951-1980":[null,null,null,null,null,null,null,null,null,null,null,null,null,null,null,null,null,null,null,null,null,null,null,null,null,null,null,null,null,null,0.049,0.043,0.078,0.07,0.11,0.043,0.014,0.046,0.116,0.063,0.065,0.092,0.152,0.101,0.093,0.132,0.084,0.061,0.116,0.084,0.063,0.05,0.072,0.082,0.042,0.065,0.015,0.037,0.002,-0.031,0.007,0.016,0.029,0.04,0.024,-0.029,-0.021,0.006,0.049,-0.022,-0.044,-0.022,-0.025,-0.029,-0.04,-0.02,-0.066,-0.069,-0.07,-0.05,-0.065,-0.069,-0.094,-0.092,-0.085,-0.123,-0.109,-0.143,-0.117,-0.125,-0.108,0.066,0.014,0.036,0.02,0.013,-0.018,-0.004,-0.048,-0.025,-0.002,-0.067,-0.07,-0.065,-0.083,-0.007,0.012,0.02,0.015,0.013,0.023,-0.0,0.018,0.009,0.026,0.017,0.01,0.017,0.003,0.002,0.034,0.045,0.019,0.027,0.014,0.009,0.029,-0.013,-0.024,-0.011,-0.022,-0.011,0.022,0.008,0.022,-0.016,-0.001,-0.006,0.021,0.007,0.003,-0.02,0.011,-0.023,-0.006,-0.018,-0.031,-0.043,-0.057,-0.028,-0.025,-0.043,-0.001,-0.015,-0.021,-0.016,-0.017,-0.014,-0.01,-0.026,-0.045,-0.018,-0.019,-0.038,-0.015,-0.017,-0.009,-0.018,0.001,-0.004,-0.005,-0.013,-0.005,-0.035,0.011,0.029],"1991-2020":[null,null,null,null,null,null,null,null,null,null,null,null,null,null,null,null,null,null,null,null,null,null,null,null,null,null,null,null,null,null,0.069,0.063,0.098,0.09,0.13,0.063,0.033,0.065,0.136,0.083,0.085,0.111,0.172,0.121,0.112,0.152,0.104,0.081,0.136,0.104,0.083,0.069,0.092,0.101,0.062,0.085,0.035,0.056,0.022,-0.011,0.026,0.036,0.049,0.06,0.044,-0.009,-0.001,0.026,0.069,-0.003,-0.025,-0.003,-0.005,-0.009,-0.021,-0.0,-0.046,-0.049,-0.051,-0.031,-0.045,-0.05,-0.074,-0.073,-0.066,-0.103,-0.089,-0.123,-0.097,-0.105,-0.089,0.085,0.033,0.056,0.04,0.033,0.002,0.016,-0.029,-0.005,0.017,-0.047,-0.05,-0.045,-0.064,0.013,0.032,0.04,0.034,0.033,0.043,0.02,0.037,0.029,0.046,0.036,0.03,0.037,0.023,0.021,0.054,0.064,0.038,0.047,0.034,0.029,0.049,0.007,-0.004,0.009,-0.003,0.009,0.042,0.028,0.042,0.003,0.019,0.014,0.041,0.027,0.022,0.0,0.03,-0.003,0.013,0.001,-0.011,-0.023,-0.037,-0.009,-0.005,-0.023,0.018,0.004,-0.001,0.004,0.003,0.006,0.01,-0.007,-0.025,0.002,0.001,-0.018,0.005,0.003,0.011,0.001,0.021,0.015,0.015,0.006,0.015,-0.015,0.031,0.049]},"gistemp":{"1951-1980":[null,null,null,null,null,null,null,null,null,null,null,null,null,null,null,null,null,null,null,null,null,null,null,null,null,null,null,null,null,null,-0.172,-0.087,-0.112,-0.176,-0.282,-0.333,-0.313,-0.362,-0.177,-0.107,-0.355,-0.224,-0.272,-0.312,-0.303,-0.227,-0.112,-0.111,-0.275,-0.177,-0.084,-0.155,-0.282,-0.371,-0.472,-0.258,-0.217,-0.381,-0.422,-0.482,-0.434,-0.442,-0.366,-0.342,-0.154,-0.138,-0.36,-0.457,-0.297,-0.274,-0.268,-0.183,-0.282,-0.262,-0.268,-0.218,-0.105,-0.214,-0.198,-0.36,-0.153,-0.089,-0.157,-0.284,-0.128,-0.2,-0.15,-0.031,-0.002,-0.021,0.122,0.181,0.063,0.087,0.203,0.094,-0.071,-0.027,-0.107,-0.111,-0.175,-0.071,0.01,0.082,-0.133,-0.14,-0.189,0.048,0.061,0.031,-0.025,0.057,0.031,0.053,-0.2,-0.108,-0.057,-0.023,-0.083,0.053,0.028,-0.08,0.009,0.161,-0.072,-0.012,-0.097,0.178,0.067,0.164,0.257,0.323,0.139,0.315,0.155,0.118,0.18,0.322,0.388,0.273,0.448,0.406,0.223,0.231,0.313,0.445,0.333,0.465,0.608,0.383,0.393,0.533,0.628,0.616,0.534,0.678,0.643,0.665,0.543,0.657,0.723,0.608,0.646,0.674,0.747,0.895,1.01,0.913,0.848,0.978,1.005,0.848,0.89,1.168,1.282,1.185],"1991-2020":[null,null,null,null,null,null,null,null,null,null,null,null,null,null,null,null,null,null,null,null,null,null,null,null,null,null,null,null,null,null,-0.784,-0.699,-0.723,-0.787,-0.894,-0.945,-0.925,-0.973,-0.788,-0.719,-0.966,-0.836,-0.884,-0.923,-0.915,-0.838,-0.723,-0.722,-0.886,-0.789,-0.696,-0.766,-0.894,-0.982,-1.084,-0.87,-0.829,-0.992,-1.034,-1.094,-1.046,-1.054,-0.977,-0.954,-0.766,-0.75,-0.971,-1.069,-0.908,-0.886,-0.88,-0.795,-0.894,-0.874,-0.88,-0.83,-0.716,-0.826,-0.81,-0.971,-0.765,-0.701,-0.769,-0.896,-0.74,-0.811,-0.761,-0.642,-0.614,-0.632,-0.49,-0.431,-0.548,-0.525,-0.409,-0.517,-0.682,-0.639,-0.719,-0.722,-0.786,-0.682,-0.601,-0.53,-0.745,-0.751,-0.801,-0.564,-0.551,-0.581,-0.636,-0.555,-0.581,-0.558,-0.811,-0.72,-0.668,-0.635,-0.695,-0.559,-0.584,-0.691,-0.602,-0.451,-0.683,-0.624,-0.708,-0.434,-0.545,-0.447,-0.355,-0.289,-0.472,-0.296,-0.456,-0.493,-0.431,-0.29,-0.223,-0.339,-0.163,-0.206,-0.389,-0.381,-0.298,-0.166,-0.278,-0.146,-0.003,-0.229,-0.218,-0.078,0.017,0.004,-0.077,0.067,0.031,0.054,-0.069,0.045,0.111,-0.004,0.034,0.063,0.135,0.284,0.399,0.301,0.237,0.366,0.394,0.236,0.279,0.556,0.67,0.574]},"hadcrut5":{"1951-1980":[-0.344,-0.175,-0.141,-0.181,-0.213,-0.211,-0.249,-0.4,-0.326,-0.213,-0.329,-0.385,-0.475,-0.302,-0.413,-0.312,-0.32,-0.317,-0.28,-0.237,-0.247,-0.293,-0.228,-0.24,-0.284,-0.285,-0.33,-0.001,0.091,-0.209,-0.222,-0.13,-0.19,-0.246,-0.392,-0.376,-0.327,-0.407,-0.292,-0.171,-0.42,-0.316,-0.425,-0.413,-0.396,-0.359,-0.196,-0.172,-0.391,-0.261,-0.147,-0.204,-0.354,-0.452,-0.514,-0.323,-0.232,-0.417,-0.425,-0.451,-0.441,-0.459,-0.395,-0.382,-0.178,-0.109,-0.339,-0.463,-0.345,-0.252,-0.224,-0.161,-0.257,-0.234,-0.228,-0.198,-0.039,-0.145,-0.128,-0.31,-0.089,-0.02,-0.064,-0.192,-0.043,-0.077,-0.041,0.112,0.114,0.104,0.23,0.115,0.05,0.051,0.182,0.081,-0.053,-0.024,-0.059,-0.086,-0.172,-0.004,0.08,0.147,-0.05,-0.133,-0.201,0.028,0.046,0.018,-0.048,0.057,0.013,0.044,-0.226,-0.125,-0.067,-0.04,-0.086,0.051,-0.006,-0.124,-0.009,0.134,-0.085,-0.022,-0.126,0.191,0.091,0.175,0.279,0.334,0.117,0.307,0.133,0.135,0.181,0.327,0.367,0.265,0.446,0.426,0.212,0.253,0.32,0.463,0.364,0.508,0.665,0.411,0.419,0.576,0.63,0.631,0.555,0.694,0.66,0.679,0.553,0.683,0.768,0.625,0.665,0.712,0.761,0.912,1.019,0.931,0.847,0.982,1.01,0.861,0.895,1.202,1.27,1.156],"1991-2020":[-0.975,-0.807,-0.773,-0.813,-0.844,-0.842,-0.88,-1.032,-0.957,-0.845,-0.961,-1.016,-1.106,-0.933,-1.045,-0.943,-0.951,-0.948,-0.911,-0.868,-0.878,-0.925,-0.86,-0.871,-0.915,-0.917,-0.961,-0.633,-0.541,-0.84,-0.853,-0.761,-0.821,-0.877,-1.023,-1.007,-0.958,-1.038,-0.924,-0.802,-1.051,-0.947,-1.056,-1.044,-1.027,-0.99,-0.827,-0.803,-1.022,-0.892,-0.779,-0.836,-0.986,-1.083,-1.146,-0.954,-0.864,-1.049,-1.056,-1.082,-1.072,-1.09,-1.026,-1.014,-0.81,-0.741,-0.97,-1.094,-0.977,-0.883,-0.855,-0.792,-0.889,-0.865,-0.859,-0.829,-0.67,-0.776,-0.759,-0.941,-0.72,-0.651,-0.695,-0.823,-0.674,-0.709,-0.672,-0.519,-0.517,-0.527,-0.401,-0.516,-0.582,-0.581,-0.449,-0.55,-0.684,-0.655,-0.69,-0.717,-0.804,-0.635,-0.551,-0.485,-0.681,-0.764,-0.832,-0.604,-0.585,-0.613,-0.679,-0.574,-0.618,-0.587,-0.857,-0.756,-0.698,-0.672,-0.717,-0.58,-0.638,-0.756,-0.641,-0.498,-0.717,-0.653,-0.757,-0.441,-0.54,-0.456,-0.352,-0.297,-0.514,-0.324,-0.499,-0.497,-0.45,-0.304,-0.264,-0.366,-0.185,-0.206,-0.419,-0.378,-0.311,-0.168,-0.267,-0.123,0.034,-0.22,-0.213,-0.055,-0.001,0.0,-0.076,0.063,0.029,0.048,-0.078,0.052,0.136,-0.006,0.034,0.081,0.13,0.281,0.388,0.3,0.216,0.351,0.379,0.23,0.264,0.571,0.639,0.525]},"stats":{"1951-1980":{"corr":0.99238,"corr_first_differences":0.9662,"max_abs_diff":0.1522,"max_abs_diff_year":1892,"mean_diff":0.0003,"n":146,"rmsd":0.0519,"trend_gap_per_decade":-0.0046,"trend_gistemp_per_decade":0.0826,"trend_hadcrut5_per_decade":0.0872},"1991-2020":{"corr":0.99238,"corr_first_differences":0.9662,"max_abs_diff":0.1719,"max_abs_diff_year":1892,"mean_diff":0.02,"n":146,"rmsd":0.0556,"trend_gap_per_decade":-0.0046,"trend_gistemp_per_decade":0.0826,"trend_hadcrut5_per_decade":0.0872}}},"baseline_used":"1951-1980","by_decade":[{"decade":1880,"mean_diff":0.0632,"n":10},{"decade":1890,"mean_diff":0.098,"n":10},{"decade":1900,"mean_diff":0.0396,"n":10},{"decade":1910,"mean_diff":0.0099,"n":10},{"decade":1920,"mean_diff":-0.0436,"n":10},{"decade":1930,"mean_diff":-0.1021,"n":10},{"decade":1940,"mean_diff":-0.0053,"n":10},{"decade":1950,"mean_diff":-0.0235,"n":10},{"decade":1960,"mean_diff":0.0125,"n":10},{"decade":1970,"mean_diff":0.013,"n":10},{"decade":1980,"mean_diff":0.0024,"n":10},{"decade":1990,"mean_diff":-0.0212,"n":10},{"decade":2000,"mean_diff":-0.0189,"n":10},{"decade":2010,"mean_diff":-0.0181,"n":10},{"decade":2020,"mean_diff":-0.003,"n":6}],"common_period":[1880,2025],"coverage_matched":{"baseline":"1951-1980","box_deg":10,"corr":0.99498,"diff":[null,null,null,null,null,null,null,null,null,null,null,null,null,null,null,null,null,null,null,null,null,null,null,null,null,null,null,null,null,null,0.019,0.002,0.025,0.022,0.054,0.007,0.017,0.016,0.08,0.05,0.014,0.05,0.087,0.054,0.069,0.079,0.061,0.066,0.086,0.065,0.075,0.042,0.063,0.077,0.037,0.074,0.01,0.023,0.008,-0.03,0.008,0.009,0.014,0.031,0.015,-0.031,-0.04,-0.01,-0.007,-0.033,-0.032,-0.013,-0.026,-0.028,-0.039,-0.014,-0.047,-0.064,-0.055,-0.047,-0.044,-0.05,-0.083,-0.092,-0.075,-0.116,-0.092,-0.124,-0.119,-0.128,-0.082,0.109,0.023,0.03,0.04,0.028,-0.001,-0.014,-0.041,-0.031,-0.005,-0.056,-0.063,-0.045,-0.08,-0.014,0.009,0.028,0.006,0.007,0.018,0.006,0.029,0.013,0.017,0.016,0.005,0.011,0.015,0.008,0.032,0.032,0.02,0.021,0.021,0.0,0.006,-0.004,-0.023,-0.011,-0.022,-0.01,0.011,0.0,0.02,-0.007,0.004,-0.01,0.011,0.002,-0.002,-0.019,-0.006,-0.041,-0.014,-0.029,-0.035,-0.05,-0.057,-0.04,-0.028,-0.04,-0.003,-0.015,-0.022,-0.022,-0.029,-0.027,-0.025,-0.028,-0.04,-0.022,-0.03,-0.034,-0.028,-0.026,-0.006,-0.023,0.001,-0.011,-0.007,-0.014,-0.008,-0.021,0.02,0.032],"gistemp_common":[null,null,null,null,null,null,null,null,null,null,null,null,null,null,null,null,null,null,null,null,null,null,null,null,null,null,null,null,null,null,-0.203,-0.147,-0.164,-0.243,-0.355,-0.381,-0.316,-0.396,-0.22,-0.128,-0.408,-0.247,-0.337,-0.368,-0.318,-0.278,-0.125,-0.105,-0.315,-0.209,-0.072,-0.164,-0.299,-0.394,-0.481,-0.253,-0.232,-0.405,-0.418,-0.477,-0.423,-0.441,-0.39,-0.348,-0.163,-0.139,-0.376,-0.468,-0.366,-0.292,-0.257,-0.159,-0.283,-0.251,-0.253,-0.196,-0.067,-0.194,-0.172,-0.35,-0.121,-0.052,-0.128,-0.266,-0.101,-0.177,-0.118,0.004,0.019,-0.01,0.151,0.236,0.084,0.089,0.229,0.102,-0.035,-0.019,-0.082,-0.109,-0.176,-0.04,0.027,0.126,-0.121,-0.142,-0.202,0.058,0.062,0.036,-0.018,0.066,0.058,0.068,-0.211,-0.112,-0.062,-0.034,-0.08,0.048,